{
  "$schema": "https://json-schema.org/draft/2020-12/schema",
  "$id": "https://models.geonicdb.com/schema/task/Comment/v1.0.0.json",
  "title": "Comment",
  "description": "A note, handover or reply on a task: a Redmine journal note, a GitHub issue comment. Field change history is not a comment; the temporal API keeps history.",
  "x-version": "1.0.0",
  "x-license-url": "https://models.geonicdb.com/LICENSE-CONTENT",
  "x-model-tags": "GeonicDB, task management, GTT",
  "x-derived-from": "https://www.rfc-editor.org/rfc/rfc8984.html",
  "type": "object",
  "properties": {
    "id": {
      "type": "string",
      "format": "uri",
      "description": "Entity id (URN)"
    },
    "type": {
      "type": "string",
      "const": "Comment",
      "description": "Entity type"
    },
    "task": {
      "type": "string",
      "format": "uri",
      "description": "The task this belongs to",
      "x-ngsi": {
        "type": "Relationship",
        "target": "https://models.geonicdb.com/ns/task/Task"
      },
      "x-iri": "https://models.geonicdb.com/ns/task/task"
    },
    "author": {
      "type": "string",
      "format": "uri",
      "description": "Creator (a person, organisation or team entity)",
      "x-ngsi": {
        "type": "Relationship",
        "target": "agent"
      },
      "x-iri": "https://schema.org/author"
    },
    "text": {
      "type": "string",
      "description": "The text",
      "x-ngsi": {
        "type": "Property"
      },
      "x-iri": "https://schema.org/text"
    },
    "textFormat": {
      "type": "string",
      "enum": [
        "text",
        "markdown",
        "textile",
        "html"
      ],
      "description": "Format of the text",
      "x-ngsi": {
        "type": "Property"
      },
      "x-iri": "https://models.geonicdb.com/ns/task/textFormat"
    },
    "inReplyTo": {
      "type": "string",
      "format": "uri",
      "description": "The comment this replies to",
      "x-ngsi": {
        "type": "Relationship",
        "target": "https://models.geonicdb.com/ns/task/Comment"
      },
      "x-iri": "https://models.geonicdb.com/ns/task/inReplyTo"
    },
    "isPrivate": {
      "type": "boolean",
      "description": "true when private; default false",
      "x-ngsi": {
        "type": "Property"
      },
      "x-iri": "https://models.geonicdb.com/ns/task/isPrivate"
    },
    "sentAt": {
      "type": "string",
      "format": "date-time",
      "description": "When it was posted",
      "x-ngsi": {
        "type": "Property"
      },
      "x-iri": "https://schema.org/dateSent"
    },
    "source": {
      "type": "string",
      "format": "uri",
      "description": "URL of this object in the system of record",
      "x-ngsi": {
        "type": "Property"
      },
      "x-iri": "https://smart-data-models.github.io/data-models/terms.jsonld#/definitions/source"
    },
    "externalId": {
      "type": "string",
      "description": "Identifier in the system of record",
      "x-ngsi": {
        "type": "Property"
      },
      "x-iri": "https://models.geonicdb.com/ns/task/externalId"
    }
  },
  "required": [
    "id",
    "type",
    "task",
    "text"
  ],
  "additionalProperties": false
}
